{
  "id": "welder_ip_sk_202404",
  "trade": "Welder",
  "exam": "Interprovincial Red Seal",
  "blueprintVersion": "1.0.0",
  "policyVersion": "1.0",
  "questionCount": 125,
  "validFrom": "2024-04-01",
  "sources": [
    {
      "type": "primary",
      "name": "Saskatchewan Welding Trade Blueprint 2024",
      "notes": "SK-2024 release aligning with Welder IP structure"
    },
    {
      "type": "historical",
      "name": "British Columbia Interprovincial Welding Blueprint 2014",
      "notes": "Legacy distribution used for comparative analytics"
    },
    {
      "type": "reference",
      "name": "Red Seal RSOS Welding Guide",
      "notes": "Competency statements and performance objectives"
    },
    {
      "type": "reference",
      "name": "Red Seal Exam Preparation Handbook",
      "notes": "Study strategies and sample MCQ frameworks"
    }
  ],
  "blocks": [
    {
      "code": "A",
      "title": "Common Occupational Skills",
      "tasks": [
        {
          "id": "A-1",
          "title": "Maintains tools and equipment",
          "quota": 4
        },
        {
          "id": "A-2",
          "title": "Uses access and material handling equipment",
          "quota": 4
        },
        {
          "id": "A-3",
          "title": "Performs safety-related activities",
          "quota": 5
        },
        {
          "id": "A-4",
          "title": "Organizes work",
          "quota": 7
        },
        {
          "id": "A-5",
          "title": "Performs routine trade activities",
          "quota": 4
        }
      ]
    },
    {
      "code": "B",
      "title": "Fabrication & Preparation",
      "tasks": [
        {
          "id": "B-6",
          "title": "Performs layout",
          "quota": 10
        },
        {
          "id": "B-7",
          "title": "Fabricates components",
          "quota": 15
        }
      ]
    },
    {
      "code": "C",
      "title": "Cutting & Gouging",
      "tasks": [
        {
          "id": "C-8",
          "title": "Non‑thermal cutting & grinding",
          "quota": 5
        },
        {
          "id": "C-9",
          "title": "Oxy‑fuel gas cutting",
          "quota": 7
        },
        {
          "id": "C-10",
          "title": "Plasma arc cutting",
          "quota": 5
        },
        {
          "id": "C-11",
          "title": "Air carbon arc cutting",
          "quota": 4
        }
      ]
    },
    {
      "code": "D",
      "title": "Welding Processes",
      "tasks": [
        {
          "id": "D-12",
          "title": "SMAW",
          "quota": 18
        },
        {
          "id": "D-13",
          "title": "FCAW/MCAW/GMAW",
          "quota": 21
        },
        {
          "id": "D-14",
          "title": "GTAW",
          "quota": 12
        },
        {
          "id": "D-15",
          "title": "SAW",
          "quota": 4
        }
      ]
    }
  ]
}
